{
  "schema_version": "document_identity_v1",
  "paper_id": "paper_001",
  "document_id": "doc_001",
  "owner_id": "owner_001",
  "source_type": "uploaded",
  "mapping_version": "document_mapping_v1",
  "source_created_time": "2026-07-22T00:00:00Z",
  "source_updated_time": "2026-07-22T00:00:00Z"
}
